### ISSUE TITLE
Bug: [Smartswitch] gnmi configuration fails for the first dash object when DPU is powered off and powered back on due to zmq connection

### ISSUE THREAD

**Issue by gpunathilell** [Azure/sonic-buildimage#23110]
### Is it platform specific

generic

### Importance or Severity

Critical

### Description of the bug

This bug is caused when we apply DASH related configuration to the DPU using any configuration tool via gnmi. After the configuration is applied and we perform a DPU power off + DPU power on, if we apply any configuration the first object is "lost" without any indication at the DPU, it is also 100% reproducible. Issue is because the existing zmq connection setup is not closed gracefully, so the switch tries to push the data on the existing port  (from when the DPU was previously powered on) and there is a RST from the DPU, a new connection is established after which new DASH objects can be configured without issues

### Steps to Reproduce

The smartswitch should be in light mode. 
Push gnmi configuration from external entity (using any gnmi client utility)
Observe new connection being setup on switch and DPU:
On switch:
```
root@sonic:/home/admin# netstat -an | grep 8100
tcp        0      0 X.X.X.X:8100        0.0.0.0:*               LISTEN
tcp        0      0 169.254.200.254:33524   169.254.200.2:8100      ESTABLISHED
```
On DPU:
```
root@sonic:/home/admin# netstat -an | grep 8100
tcp        0      0 169.254.200.2:8100      0.0.0.0:*               LISTEN
tcp        0      0 169.254.200.2:8100      169.254.200.254:33524   ESTABLISHED
```
Power off the DPU and power it back on:
`config chassis modules shutdown DPU1`
`config chassis modules startup DPU1`
On swtich the netstat output still says connection established on the same port even though DPU is powered off:
```
root@sonic:/home/admin# netstat -an | grep 8100
tcp        0      0 X.X.X.X:8100        0.0.0.0:*               LISTEN
tcp        0      0 169.254.200.254:33524   169.254.200.2:8100      ESTABLISHED
```
On DPU after power on:
```
root@sonic:/home/admin# netstat -an | grep 8100
tcp        0      0 169.254.200.2:8100      0.0.0.0:*               LISTEN
```
When a new configuration is pushed, the first object is sent as a tcp packet with the push flag by TCP (but to the old port), to which the DPU replies with a Reset packet, and then a new connection is established (but the data is not received at the DPU)
```
root@sonic:/home/admin# tcpdump -i eth0-midplane port 8100
tcpdump: verbose output suppressed, use -v[v]... for full protocol decode
listening on eth0-midplane, link-type EN10MB (Ethernet), snapshot length 262144 bytes
13:49:36.464320 IP redis_chassis.server.33524 > 169.254.200.2.8100: Flags [P.], seq 3300533063:3300533174, ack 3675998997, win 126, options [n
op,nop,TS val 3627016953 ecr 2591043297], length 111
13:49:36.464407 IP 169.254.200.2.8100 > redis_chassis.server.33524: Flags [R], seq 3675998997, win 0, length 0
13:49:36.640815 IP redis_chassis.server.35180 > 169.254.200.2.8100: Flags [S], seq 280557074, win 64240, options [mss 1460,sackOK,TS val 36270
17130 ecr 0,nop,wscale 9], length 0
13:49:36.640869 IP 169.254.200.2.8100 > redis_chassis.server.35180: Flags [S.], seq 2096442980, ack 280557075, win 65160, options [mss 1460,sa
ckOK,TS val 2533807394 ecr 3627017130,nop,wscale 9], length 0
```
Subsequent pushes using the gnmi client tools work without issues. Only the first object is not configured.
Issue is not seen when the whole system is powered on together (i.e. if system reboot is executed) or if we perform switch config reload before configuration, because switch establishes new connections to the DPU 

### Actual Behavior and Expected Behavior

Actual Behaviour:
First object is lost when performing configuration
Expected Behaviour
No issues with configuration

### Relevant log output

```shell

```

### Output of `show version`, `show techsupport`

```shell
Latest master image
```

**Comment by gpunathilell** [comment]
@prsunny for viz

**Comment by bingwang-ms** [comment]
@prabhataravind Can you help triage this issue?

**Comment by KrisNey-MSFT** [comment]
Perhaps copy as a 2nd bug to handle wholistically

**Comment by liuh-80** [comment]
@gpunathilell , can you share the GNMI service side syslog?

When DPU reboot, the ZMQ connection will break, then when send the first request after reboot, GNMI will retry connect, and if reconnect also failed, the GNMI request will failed with a "zmq connection break" error message.

When client receive this error, client should handle and resend request.

**Comment by gpunathilell** [comment]
@liuh-80 Please find the relevant gnmi.log and other relevant information:
Configuration being applied:
```
[
    {
        "DASH_VNET_TABLE:Vnet1": {
            "vni": "5000",
            "guid": "559c6ce8-26ab-4193-b946-ccc6e8f930b2"
        },
        "OP": "SET"
    }
]
``` 
gnmi.log updates on switch during successful application of config to the DPU:
```
2025 Jul 15 18:28:58.210150 sonic INFO gnmi#supervisord: gnmi-native I0715 18:28:58.209771      24 server.go:617] Update path: path:{elem:{name:"APPL_DB"}  elem:{name:"dpu0"}  elem:{name:"DASH_VNET_TABLE"  key:{key:"key"  value:"Vnet1"}}}  val:{proto_bytes:"\x08\x88'\x12\x12\n\x10U\x9cl\xe8&\xabA\x93\xb9F\xcc\xc6\xe8\xf90\xb2"}
2025 Jul 15 18:28:58.210150 sonic INFO gnmi#supervisord: gnmi-native I0715 18:28:58.209983      24 mixed_db_client.go:264] Create ZmqProducerStateTable:  DASH_VNET_TABLE
2025 Jul 15 18:28:58.213320 sonic INFO gnmi#supervisord: gnmi-native 2025/07/15 18:28:58 INFO: [transport] [server-transport 0xc0037c4c00] Closing: EOF
2025 Jul 15 18:28:58.213404 sonic INFO gnmi#supervisord: gnmi-native 2025/07/15 18:28:58 INFO: [transport] [server-transport 0xc0037c4c00] loopyWriter exiting with error: transport closed by client
```
Update in swss.rec on the DPU
`2025-07-15.18:28:58.212324|DASH_VNET_TABLE:Vnet1|SET|pb�'U�l�A��F0�`

After which DPU is powered off and powered on:
`config chassis modules shutdown DPU0`
`config chassis modules startup DPU0`

Repplication of the same configuration generates the follwoing updates to the gnmi.log on the switch (which look exactly the same)
```
2025 Jul 15 18:33:27.098279 sonic INFO gnmi#supervisord: gnmi-native I0715 18:33:27.097859      24 server.go:617] Update path: path:{elem:{name:"APPL_DB"}  elem:{name:"dpu0"}  elem:{name:"DASH_VNET_TABLE"  key:{key:"key"  value:"Vnet1"}}}  val:{proto_bytes:"\x08\x88'\x12\x12\n\x10U\x9cl\xe8&\xabA\x93\xb9F\xcc\xc6\xe8\xf90\xb2"}
2025 Jul 15 18:33:27.098279 sonic INFO gnmi#supervisord: gnmi-native I0715 18:33:27.097999      24 mixed_db_client.go:264] Create ZmqProducerStateTable:  DASH_VNET_TABLE
2025 Jul 15 18:33:27.100349 sonic INFO gnmi#supervisord: gnmi-native 2025/07/15 18:33:27 INFO: [transport] [server-transport 0xc0047d8c00] Closing: EOF
2025 Jul 15 18:33:27.100413 sonic INFO gnmi#supervisord: gnmi-native 2025/07/15 18:33:27 INFO: [transport] [server-transport 0xc0047d8c00] loopyWriter exiting with error: transport closed by client
```
No updates observed in swss.rec (indicating the config did not reach the orchagent)

**Comment by prabhataravind** [comment]
hi @liuh-80, any findings from the logs or any suggestions for Nvidia to try?

**Comment by liuh-80** [comment]
> hi [@liuh-80](https://github.com/liuh-80), any findings from the logs or any suggestions for Nvidia to try?

I'm still checking this issue, for now seems not a bug, the client side should handle error and retry.

**Comment by liuh-80** [comment]
I can reproduce this issue, the issue is caused by current ZMQ config, will create a fix asap

**Comment by KrisNey-MSFT** [comment]
hi @liuh-80 - any scoop on this one?

**Comment by liuh-80** [comment]
> hi [@liuh-80](https://github.com/liuh-80) - any scoop on this one?

Hi @KrisNey-MSFT , I working on some draft fix :

https://github.com/sonic-net/sonic-swss-common/pull/1059

https://github.com/sonic-net/sonic-gnmi/pull/465

**Comment by liuh-80** [comment]
Get new progress, the root cause of this bug is:

When creating a ZmqServer followed by a ZmqProducerStateTable, there may be a time gap between the server starting to receive messages and the producer state table registering its handler.

This gap can lead to dropped messages. To avoid this, use lazy binding and invoke bind() only after the handler is registered.


Fix PR:
https://github.com/sonic-net/sonic-swss-common/pull/1068
https://github.com/sonic-net/sonic-swss/pull/3837

**Comment by liuh-80** [comment]
All fix PR merged

**Comment by KrisNey-MSFT** [comment]
hi @gpunathilell - it looks like the fixes are in.  May we close this Issue?

**Comment by gpunathilell** [comment]
> hi [@gpunathilell](https://github.com/gpunathilell) - it looks like the fixes are in. May we close this Issue?

Will test once in 202506 to confirm that it is fixed, Will close once it is confirmed.

**Comment by prabhataravind** [comment]
> > hi [@gpunathilell](https://github.com/gpunathilell) - it looks like the fixes are in. May we close this Issue?
> 
> Will test once in 202506 to confirm that it is fixed, Will close once it is confirmed.

hi @gpunathilell, the changes are in 202506 branch as well. Could you confirm and close?

**Comment by gpunathilell** [comment]
@prabhataravind @liuh-80 I was able to repro the issue, on an image which included both the PRs:
https://github.com/sonic-net/sonic-swss/pull/3837 and
https://github.com/sonic-net/sonic-swss-common/pull/1068
Let me know if additional information is required

**Comment by liuh-80** [comment]
@gpunathilell , can you also add this change to your test image?
https://github.com/sonic-net/sonic-gnmi/pull/492

**Comment by KrisNey-MSFT** [comment]
PA: pending verification and close

**Comment by KrisNey-MSFT** [comment]
hi @gpunathilell , it is ok to close this one now?

**Comment by gpunathilell** [comment]
@KrisNey-MSFT Not verified yet, I need to build an image based on 202506, @liuh-80 is it possible to create a cherry-pick for https://github.com/sonic-net/sonic-gnmi/pull/492#issuecomment-3392255111 if this is required for the fix?

**Comment by gpunathilell** [comment]
I will build locally and verify

**Comment by gpunathilell** [comment]
Issue is seen after testing on master image with 
https://github.com/sonic-net/sonic-swss-common/pull/1068
https://github.com/sonic-net/sonic-swss/pull/3837
https://github.com/sonic-net/sonic-gnmi/pull/492

**Comment by KrisNey-MSFT** [comment]
hi @prabhataravind - this one still happens, is it Vaibhav we should be working with?  TY!

**Comment by KrisNey-MSFT** [comment]
hi @prabhataravind - bug still occurring, any guidance for us?

**Comment by zjswhhh** [comment]
Noticing this is still happening with the fix. Is anyone looking into this?

**Comment by prabhataravind** [comment]
Issue is fixed with the latest swss-common fix to add keepalives to ZmqClient and ZmqServer.
