### ISSUE TITLE
Bug:RADIUS global timeout < 3s is ignored, minimum 3s enforced

### ISSUE THREAD

**Issue by Griffin-micas** [Azure/sonic-buildimage#26530]
### Is it platform specific

generic

### Importance or Severity

Medium

### Description of the bug

When configuring RADIUS global timeout less than 3 seconds, Sonic ignores the configured value and uses 3 seconds as the minimum. This makes short timeout configurations (e.g., 1–2s) ineffective.

### Steps to Reproduce

Configured AAA authentication type as RADIUS, set RADIUS timeout to 2s, and added a RADIUS server address. The server at this address is shut down to simulate a non-responsive timeout scenario:
```
admin@sonic:~$ sudo config aaa authentication login radius local
admin@sonic:~$ sudo config aaa authentication failthrough enable
admin@sonic:~$ sudo config radius add 172.31.32.50
admin@sonic:~$ sudo config radius passkey Radius@123
admin@sonic:~$ sudo config radius timeout 2
admin@sonic:~$ show aaa
AAA authentication login radius,local
AAA authentication failthrough True
AAA authorization login local (default)
AAA accounting login disable (default
admin@sonic:~$ show radius
RADIUS global auth_type pap (default)
RADIUS global retransmit 3 (default)
RADIUS global timeout 2
RADIUS global passkey Radius@123

RADIUS_SERVER address 172.31.32.50
               auth_port 1812
               priority 1
```

Attempted to login using the corresponding account. On the switch, tcpdump was used to capture packets and observe the interval between requests:
```
root@sonic:/home/admin# tcpdump -i eth0 port 1812
tcpdump: verbose output suppressed, use -v[v]... for full protocol decode
listening on eth0, link-type EN10MB (Ethernet), snapshot length 262144 bytes
07:48:16.503404 IP 10.110.198.42.49617 > 172.31.32.50.radius: RADIUS, Access-Request (1), id: 0xaf length: 113
07:48:19.505216 IP 10.110.198.42.49617 > 172.31.32.50.radius: RADIUS, Access-Request (1), id: 0xaf length: 113
07:48:22.508378 IP 10.110.198.42.49617 > 172.31.32.50.radius: RADIUS, Access-Request (1), id: 0xaf length: 113
07:48:25.509210 IP 10.110.198.42.49617 > 172.31.32.50.radius: RADIUS, Access-Request (1), id: 0xaf length: 113
```
Although the RADIUS timeout was configured as 2 seconds, the actual interval between Access-Request packets is approximately 3 seconds. This indicates that the Sonic system or the underlying RADIUS client library enforces a minimum timeout of 3 seconds, ignoring configurations below this threshold. This behavior causes a mismatch between the CLI configuration and the actual runtime behavior.

### Actual Behavior and Expected Behavior

Actual Behavior:
When configuring RADIUS global timeout less than 3 seconds (e.g., 2s), the system ignores the configured value. 
Access-Request packets are still sent every ~3 seconds, as observed via  tcpdump . 
CLI shows the configured timeout (e.g., 2s), but the underlying behavior uses a fixed 3-second minimum. 
 
Expected Behavior:
The RADIUS global timeout should respect the configured value, even if it is less than 3 seconds. 
Access-Request packets should be sent according to the configured timeout interval (e.g., 2s). 
CLI display and actual runtime behavior should be consistent.

### Relevant log output

```shell

```

### Output of `show version`, `show techsupport`

```shell
admin@sonic:~$ show version

SONiC Software Version: SONiC.master.1076572-9bbf9cafc
SONiC OS Version: 13
Distribution: Debian 13.4
Kernel: 6.12.41+deb13-sonic-amd64
Build commit: 9bbf9cafc
Build date: Wed Apr  1 15:28:00 UTC 2026
Built by: azureuser@5816740cc000000

Platform: x86_64-micas_m2-w6510-32c-r0
HwSKU: M2-W6510-32C
ASIC: broadcom
ASIC Count: 1
Serial Number: N/A
Model Number: N/A
Hardware Revision: N/A
Uptime: 08:16:16 up 58 min,  2 users,  load average: 1.94, 1.38, 0.84
Date: Thu 02 Apr 2026 08:16:16

Docker images:
REPOSITORY                    TAG                        IMAGE ID       SIZE
docker-syncd-brcm             latest                     9c2c5b58026a   825MB
docker-syncd-brcm             master.1076572-9bbf9cafc   9c2c5b58026a   825MB
docker-gbsyncd-agera2         latest                     ebf7f79a8892   374MB
docker-gbsyncd-agera2         master.1076572-9bbf9cafc   ebf7f79a8892   374MB
docker-gbsyncd-broncos        latest                     9ff22f2d6e86   319MB
docker-gbsyncd-broncos        master.1076572-9bbf9cafc   9ff22f2d6e86   319MB
docker-gbsyncd-credo          latest                     c2d4034222bd   292MB
docker-gbsyncd-credo          master.1076572-9bbf9cafc   c2d4034222bd   292MB
docker-dhcp-relay             latest                     15256b5d430e   325MB
docker-dhcp-relay             master.1076572-9bbf9cafc   15256b5d430e   325MB
docker-teamd                  latest                     467d84270ab1   319MB
docker-teamd                  master.1076572-9bbf9cafc   467d84270ab1   319MB
docker-router-advertiser      latest                     9f29c3f424f3   283MB
docker-router-advertiser      master.1076572-9bbf9cafc   9f29c3f424f3   283MB
docker-database               latest                     43285d1b5c46   289MB
docker-database               master.1076572-9bbf9cafc   43285d1b5c46   289MB
docker-platform-monitor       latest                     e4b7ea1fb340   399MB
docker-platform-monitor       master.1076572-9bbf9cafc   e4b7ea1fb340   399MB
docker-sflow                  latest                     b08ecae70bff   302MB
docker-sflow                  master.1076572-9bbf9cafc   b08ecae70bff   302MB
docker-orchagent              latest                     0580cc63c311   313MB
docker-orchagent              master.1076572-9bbf9cafc   0580cc63c311   313MB
docker-nat                    latest                     4de119e81634   303MB
docker-nat                    master.1076572-9bbf9cafc   4de119e81634   303MB
docker-fpm-frr                latest                     2be3dd93c644   352MB
docker-fpm-frr                master.1076572-9bbf9cafc   2be3dd93c644   352MB
docker-dash-ha                latest                     8a74dc63f5f0   319MB
docker-dash-ha                master.1076572-9bbf9cafc   8a74dc63f5f0   319MB
docker-macsec                 latest                     bbd0effbf79b   303MB
docker-macsec                 master.1076572-9bbf9cafc   bbd0effbf79b   303MB
docker-sonic-bmp              latest                     61d0f21c9c14   270MB
docker-sonic-bmp              master.1076572-9bbf9cafc   61d0f21c9c14   270MB
docker-eventd                 latest                     a293d39fa37b   266MB
docker-eventd                 master.1076572-9bbf9cafc   a293d39fa37b   266MB
docker-telemetry-watchdog     latest                     7af1a5c39258   395MB
docker-telemetry-watchdog     master.1076572-9bbf9cafc   7af1a5c39258   395MB
docker-snmp                   latest                     8099110ad667   290MB
docker-snmp                   master.1076572-9bbf9cafc   8099110ad667   290MB
docker-telemetry-sidecar      latest                     1c852d4af61e   265MB
docker-telemetry-sidecar      master.1076572-9bbf9cafc   1c852d4af61e   265MB
docker-sysmgr                 latest                     d76d94ec38ce   277MB
docker-sysmgr                 master.1076572-9bbf9cafc   d76d94ec38ce   277MB
docker-sonic-otel             latest                     f5f049c4e35e   607MB
docker-sonic-otel             master.1076572-9bbf9cafc   f5f049c4e35e   607MB
docker-sonic-mgmt-framework   latest                     41894ae86fde   360MB
docker-sonic-mgmt-framework   master.1076572-9bbf9cafc   41894ae86fde   360MB
docker-sonic-gnmi             latest                     f00ee336ecb0   394MB
docker-sonic-gnmi             master.1076572-9bbf9cafc   f00ee336ecb0   394MB
docker-restapi-sidecar        latest                     b6e2b420f4d4   266MB
docker-restapi-sidecar        master.1076572-9bbf9cafc   b6e2b420f4d4   266MB
docker-mux                    latest                     73bb821ee156   278MB
docker-mux                    master.1076572-9bbf9cafc   73bb821ee156   278MB
docker-gnmi-watchdog          latest                     5fe6317ad651   272MB
docker-gnmi-watchdog          master.1076572-9bbf9cafc   5fe6317ad651   272MB
docker-lldp                   latest                     92c00466094c   311MB
docker-lldp                   master.1076572-9bbf9cafc   92c00466094c   311MB
docker-gnmi-sidecar           latest                     e28bcc3f42bd   265MB
docker-gnmi-sidecar           master.1076572-9bbf9cafc   e28bcc3f42bd   265MB
docker-bmp-watchdog           latest                     c9119b785a7b   266MB
docker-bmp-watchdog           master.1076572-9bbf9cafc   c9119b785a7b   266MB
```

**Comment by Griffin-micas** [comment]
Thank you very much for taking this on. @AgrimTawani 

Your understanding is correct. The configuration path itself looks fine to me; the issue seems to be in how the PAM RADIUS runtime handles the timeout value.
So yes, looking into the pam_radius source and fixing it via a patch under src/radius/pam/debian/patches sounds like the right direction. Please feel free to proceed and open a PR linked to this issue.
Thanks again for working on this!

**Comment by Griffin-micas** [comment]
Thanks a lot for the fix! @AgrimTawani 
I’ve verified the changes and the issue is resolved on my side. Really appreciate your help.
