### ISSUE TITLE
[201911] PortChannel PING failed 

### ISSUE THREAD

**Issue by tim-rj** [Azure/sonic-buildimage#4734]
**Description**
PortChannel PING failed

**Steps to reproduce the issue:**
1.Create vlan 3 and portchannle,add portchannel into vlan 3, add ip 150.1.1.1 for vlan 3
root@switch2:/etc/sonic# show interfaces portchannel 
Flags: A - active, I - inactive, Up - up, Dw - Down, N/A - not available,
       S - selected, D - deselected, * - not synced
  No.  Team Dev      Protocol     Ports
-----  ------------  -----------  ------------
  1  PortChannel1  LACP(A)(Up)  Ethernet0(S)

root@switch2:/etc/sonic# show vlan config 
Name      VID  Member        Mode
------  -----  ------------  --------
Vlan3       3  PortChannel1  untagged
root@switch2:/etc/sonic# show ip interfaces 
Interface    Master    IPv4 address/mask    Admin/Oper    BGP Neighbor    Neighbor IP
-----------  --------  -------------------  ------------  --------------  -------------
Ethernet24             10.0.0.48/31         up/down       N/A             N/A
Ethernet52             50.5.1.1/31          up/up         LC              50.5.1.0
Loopback0              6.6.6.6/32           up/up         N/A             N/A
Vlan3                  150.1.1.1/16         up/up         N/A             N/A
docker0                240.127.1.1/24       up/down       N/A             N/A
eth0                   172.28.57.33/24      up/up         N/A             N/A
lo                     127.0.0.1/8          up/up         N/A             N/A
root@switch2:/etc/sonic# 

PEER CONFIG:

S6500-3#show running-config interface vlan 3

Building configuration...
Current configuration : 53 bytes

interface VLAN 3
 ip address 150.1.1.2 255.255.0.0
S6500-3#show ru
S6500-3#show running-config in
S6500-3#show running-config interface TFGigabitEthernet 1/3

Building configuration...
Current configuration : 61 bytes

interface TFGigabitEthernet 1/3
 port-group 38 mode active
S6500-3#show ru
S6500-3#show running-config in
S6500-3#show running-config interface a
S6500-3#show running-config interface aggregatePort 38
Building configuration...
Current configuration : 55 bytes
interface AggregatePort 38
 switchport access vlan 3
S6500-3#

root@switch2:/var/core# show ip interfaces
Interface    Master    IPv4 address/mask    Admin/Oper    BGP Neighbor    Neighbor IP
-----------  --------  -------------------  ------------  --------------  -------------
Ethernet24             10.0.0.48/31         up/down       N/A             N/A
Ethernet52             50.5.1.1/31          up/up         LC              50.5.1.0
Loopback0              6.6.6.6/32           up/up         N/A             N/A
Vlan3                  150.1.1.1/16         up/up         N/A             N/A
docker0                240.127.1.1/24       up/down       N/A             N/A
eth0                   172.28.57.33/24      up/up         N/A             N/A
lo                     127.0.0.1/8          up/up         N/A             N/A

root@switch2:/var/core# show interfaces  status
   Interface            Lanes    Speed    MTU               Alias          Vlan    Oper    Admin             Type    Asym PFC
------------  ---------------  -------  -----  ------------------  ------------  ------  -------  ---------------  ----------
   Ethernet0                1      25G   9100   twentyfiveGigE0/1  PortChannel1      up       up   SFP/SFP+/SFP28         N/A

**Describe the results you received:**
port ping is successful:
root@switch2:/var/core# ping 50.5.1.0
PING 50.5.1.0 (50.5.1.0) 56(84) bytes of data.
64 bytes from 50.5.1.0: icmp_seq=17 ttl=64 time=0.322 ms
64 bytes from 50.5.1.0: icmp_seq=18 ttl=64 time=0.191 ms
64 bytes from 50.5.1.0: icmp_seq=19 ttl=64 time=0.253 ms

portchannel ping is failed:
root@switch2:/etc/sonic#  ping 150.1.1.2
PING 150.1.1.2 (150.1.1.2) 56(84) bytes of data.
From 150.1.1.1 icmp_seq=1 Destination Host Unreachable
From 150.1.1.1 icmp_seq=2 Destination Host Unreachable
From 150.1.1.1 icmp_seq=3 Destination Host Unreachable

**and from tcpdump resule, ARP requests for 150.1.1.2 were delay and less**
root@switch2:/home/admin# tcpdump -i Vlan3
tcpdump: verbose output suppressed, use -v or -vv for full protocol decode
listening on Vlan3, link-type EN10MB (Ethernet), capture size 262144 bytes
15:33:42.163418 ARP, Request who-has 150.0.0.1 (Broadcast) tell 150.1.5.36, length 110
15:33:42.163429 ARP, Request who-has 150.0.0.1 (Broadcast) tell 150.1.5.37, length 110
15:33:42.163440 ARP, Request who-has 150.0.0.1 (Broadcast) tell 150.1.5.38, length 110
15:33:42.163450 ARP, Request who-has 150.0.0.1 (Broadcast) tell 150.1.5.39, length 110
15:33:42.163460 ARP, Request who-has 150.0.0.1 (Broadcast) tell 150.1.5.40, length 110
15:33:42.163471 ARP, Request who-has 150.0.0.1 (Broadcast) tell 150.1.5.41, length 110
15:33:42.163481 ARP, Request who-has 150.0.0.1 (Broadcast) tell 150.1.5.42, length 110
15:33:51.891908 ARP, Request who-has 150.0.0.1 (Broadcast) tell 150.1.8.84, length 110
15:33:58.863519 ARP, Request who-has 150.0.0.1 (Broadcast) tell 150.1.5.64, length 110
15:34:02.735481 ARP, Request who-has 150.0.0.1 (Broadcast) tell 150.1.10.253, length 110

**Describe the results you expected:**
PortChannel can ping successfully after changing to newest version(that means 4 month ago, 201911's code work fine)

**Additional information you deem important (e.g. issue happens only occasionally):**

    **Output of `show version`:**

root@switch2:/etc/sonic# show version 

SONiC Software Version: SONiC.HEAD.67-8367dfeb
Distribution: Debian 9.12
Kernel: 4.9.0-11-2-amd64
Build commit: 8367dfeb
Build date: Wed May  6 13:49:49 UTC 2020
Built by: johnar@jenkins-worker-7

Platform: x86_64-ruijie_b6510-48vs8cq-r0
HwSKU: B6510-48VS8CQ
ASIC: broadcom
Serial Number: G1MW80H000123
Uptime: 14:37:35 up  4:57,  3 users,  load average: 0.57, 0.81, 0.90

Docker images:
REPOSITORY                    TAG                 IMAGE ID            SIZE
docker-syncd-brcm             HEAD.67-8367dfeb    6902f81e3ca3        430MB
docker-syncd-brcm             latest              6902f81e3ca3        430MB
docker-platform-monitor       HEAD.67-8367dfeb    299fc1d87ebf        334MB
docker-platform-monitor       latest              299fc1d87ebf        334MB
docker-router-advertiser      HEAD.67-8367dfeb    d1f31448c1b9        283MB
docker-router-advertiser      latest              d1f31448c1b9        283MB
docker-fpm-frr                HEAD.67-8367dfeb    c2b1f3dde8c8        328MB
docker-fpm-frr                latest              c2b1f3dde8c8        328MB
docker-sflow                  HEAD.67-8367dfeb    22588d030e81        308MB
docker-sflow                  latest              22588d030e81        308MB
docker-lldp-sv2               HEAD.67-8367dfeb    8a9b1ba67160        305MB
docker-lldp-sv2               latest              8a9b1ba67160        305MB
docker-orchagent              HEAD.67-8367dfeb    eed753ed4e3b        326MB
docker-orchagent              latest              eed753ed4e3b        326MB
docker-dhcp-relay             HEAD.67-8367dfeb    a91bd90f721a        293MB
docker-dhcp-relay             latest              a91bd90f721a        293MB
docker-database               HEAD.67-8367dfeb    7665762c9470        283MB
docker-database               latest              7665762c9470        283MB
docker-snmp-sv2               HEAD.67-8367dfeb    893a54916304        340MB
docker-snmp-sv2               latest              893a54916304        340MB
docker-teamd                  HEAD.67-8367dfeb    2e77c5e410ba        307MB
docker-teamd                  latest              2e77c5e410ba        307MB
docker-nat                    HEAD.67-8367dfeb    d1c78016f845        309MB
docker-nat                    latest              d1c78016f845        309MB
docker-sonic-mgmt-framework   HEAD.67-8367dfeb    f1f88830db0c        422MB
docker-sonic-mgmt-framework   latest              f1f88830db0c        422MB
docker-sonic-telemetry        HEAD.67-8367dfeb    65d82748277a        345MB
docker-sonic-telemetry        latest              65d82748277a        345MB

[syslog]
[syslog.txt](https://github.com/Azure/sonic-buildimage/files/4750672/syslog.txt)

**Comment by tim-rj** [comment]
> 
> 
> @tim-rj 1) please join the triage meeting in person to discuss the issue, 2) please check packet drop

@xinliu-seattle 1) Help share how to join such a meeting since i am a new guy here 2)It seems that there is no packet send out. Please share the method to test this, currently i am only familier with tcpdump tool. Thanks ! (There are 15 hours time diff between beijing and seattle which may lead delay response)

**Comment by tim-rj** [comment]
Update verification: The Issue has gone on newest master branch and 201911 branch. 
Shall i close this one?

**Comment by tim-rj** [comment]
And this approve that this is a bug on this build 'SONiC Software Version: SONiC.HEAD.67-8367dfeb' on the other hand, right!?

**Comment by tim-rj** [comment]
After updating to newest 201911 version and master version, this issue has gone. We will try to reproduce it later and update progress in time.

**Comment by yxieca** [comment]
@tim-rj  There are suggestions that this issue has been addressed in the latest image. Can you give it a try and close this issue accordingly?
