### ISSUE TITLE
ARP resolution across interface on a VRF doesn't use VRF's src_mac

### ISSUE THREAD

**Issue by dduttman** [Azure/sonic-buildimage#8873]
#### Description
When configuring a VRF with a src_mac attribute, the interface(s) within that VRF should provide the src_mac from the VRF in reply to ARP Requests from neighboring devices. Incoming packets after that point are expected to have a dest mac matching the L3 src_mac on the VRF, not the L2 mac on the physical interface.

The behavior we are seeing is that the L2 interface mac is provided in any ARP Reply for an interface that's part of a VRF. Thus, configuring the src_mac attribute on a VRF, at best, changes nothing. Because our SDK has additional verification that incoming packets have the expected dest_mac (in this case L3 src_mac from VRF), we drop any incoming packets after configuring the VRF src_mac.

#### Steps to reproduce the issue:
1. config vrf add Vrf1
2. config int vrf bind Ethernet2 Vrf1
3. config int ip add Ethernet2 40.0.0.1/31
4. apply following configuration to set VRF src_mac:  // unsure how to set via CLI
```
{
    "VRF": {
        "Vrf1": {
            "src_mac": "fe:78:09:49:a1:ba"   // or any mac that isn't the same as the interface mac
        }
    }
}
```
5. run "tcpdump -i Ethernet2" on second SSH session of local device
6. sonic-clear arp   // do the same on neighbor device
7. ping 40.0.0.2 -I Vrf1

#### Describe the results you received:
```
root@sonic:/tmp# tcpdump -i Ethernet2
tcpdump: verbose output suppressed, use -v or -vv for full protocol decode
listening on Ethernet2, link-type EN10MB (Ethernet), capture size 262144 bytes
01:03:29.666763 ARP, Request who-has 40.0.0.2 tell 40.0.0.1, length 28
01:03:29.669222 ARP, Reply 40.0.0.2 is-at f8:7a:41:20:6d:90 (oui Unknown), length 50
01:03:29.669235 IP 40.0.0.1 > 40.0.0.2: ICMP echo request, id 27336, seq 1, length 64
01:03:30.677902 IP 40.0.0.1 > 40.0.0.2: ICMP echo request, id 27336, seq 2, length 64
01:03:31.701905 IP 40.0.0.1 > 40.0.0.2: ICMP echo request, id 27336, seq 3, length 64
01:03:34.817881 ARP, Request who-has 40.0.0.1 tell 40.0.0.2, length 50
01:03:34.817914 ARP, Reply 40.0.0.1 is-at 8c:94:1f:8c:26:44 (oui Unknown), length 28
^C
7 packets captured
11 packets received by filter
4 packets dropped by kernel
```

On neighbor device, we can see incorrect ARP resolved:
```
cisco@sonic:~$ show arp
Address      MacAddress         Iface       Vlan
-----------  -----------------  ----------  ------
1.72.12.11   08:ec:f5:6b:22:80  eth0        -
40.0.0.1     8c:94:1f:8c:26:44  Ethernet1   -
```

#### Describe the results you expected:
ARP on neighbor device to resolve to "fe:78:09:49:a1:ba" rather than "8c:94:1f:8c:26:44". Subsequent traffic should come in with the updated dest mac as well.
successful ping

#### Output of `show version`:
```
cisco@sonic:~$ show version                                                                                         
                                                                                                                    
SONiC Software Version: SONiC.HEAD.31-dirty-20210831.055631                                                         
Distribution: Debian 10.10                                                                                          
Kernel: 4.19.0-12-2-amd64                                                                                           
Build commit: 671e4dce2                                                                                             
Build date: Tue Aug 31 12:54:46 UTC 2021                                                                            
Built by: jenkins@mb-poda2-ch2b2                                                                                    
                                                                                                                    
Platform: x86_64-8101_32h_o-r0                                                                                      
HwSKU: 32x100Gb                                                                                                     
ASIC: cisco-8000                                                                                                    
ASIC Count: 1                                                                                                       
Serial Number: FOC2434K26F                                                                                          
Cisco Silicon One SDK: 1.44.1.2-sai-1.7.1-buster-1cb5bbc88b                                                         
Cisco Whitebox BSP: 0.4-16-g94c50c25                                                                                
Cisco Whitebox FPD: 0.1-81-g79c9870-dirty                                                                           
Cisco NP Suite: None                                                                                                
Uptime: 02:39:13 up 17:59,  1 user,  load average: 1.27, 0.94, 0.88 
  
Docker images:                                                                                                      
REPOSITORY                    TAG                             IMAGE ID            SIZE                              
docker-syncd                  HEAD.31-dirty-20210831.055631   ea79595c173e        922MB                             
docker-syncd                  latest                          ea79595c173e        922MB                             
docker-snmp                   HEAD.31-dirty-20210831.055631   9efc6f17cc73        443MB                             
docker-snmp                   latest                          9efc6f17cc73        443MB                             
docker-teamd                  HEAD.31-dirty-20210831.055631   8d17e1b977ff        412MB                             
docker-teamd                  latest                          8d17e1b977ff        412MB                             
docker-nat                    HEAD.31-dirty-20210831.055631   006b7ca11e54        415MB                             
docker-nat                    latest                          006b7ca11e54        415MB                             
docker-sonic-mgmt-framework   HEAD.31-dirty-20210831.055631   bcd72cc23121        622MB                             
docker-sonic-mgmt-framework   latest                          bcd72cc23121        622MB                             
docker-router-advertiser      HEAD.31-dirty-20210831.055631   aae4bc5218c2        402MB                             
docker-router-advertiser      latest                          aae4bc5218c2        402MB                             
docker-platform-monitor       HEAD.31-dirty-20210831.055631   3e80004791bd        613MB                             
docker-platform-monitor       latest                          3e80004791bd        613MB                             
docker-lldp                   HEAD.31-dirty-20210831.055631   990710c5c30c        442MB
docker-lldp                   latest                          990710c5c30c        442MB
docker-database               HEAD.31-dirty-20210831.055631   af9d4187ed22        402MB
docker-database               latest                          af9d4187ed22        402MB
docker-orchagent              HEAD.31-dirty-20210831.055631   9c84e4e57901        431MB
docker-orchagent              latest                          9c84e4e57901        431MB
docker-dhcp-relay             HEAD.31-dirty-20210831.055631   7d3204e24452        409MB
docker-dhcp-relay             latest                          7d3204e24452        409MB
docker-sonic-telemetry        HEAD.31-dirty-20210831.055631   3f9af131a195        491MB
docker-sonic-telemetry        latest                          3f9af131a195        491MB
docker-fpm-frr                HEAD.31-dirty-20210831.055631   b7f61c8d35af        431MB
docker-fpm-frr                latest                          b7f61c8d35af        431MB
docker-sflow                  HEAD.31-dirty-20210831.055631   539c3a140006        413MB
docker-sflow                  latest                          539c3a140006        413MB
```

#### Additional information you deem important (e.g. issue happens only occasionally):
packet is dropped because of our RX processing in SDK that detects the mismatched dest mac. This RX processing gets configured upon SAI layer receiving attribute SAI_VIRTUAL_ROUTER_ATTR_SRC_MAC_ADDRESS during src_mac configuration. With that, we configure internal tables to set expectation for incoming packets.

Our expectation is that SONiC is handling Linux kernel interactions here to set/update any ARP cache necessary to get the expected ARP Reply with the updated src_mac.

**Comment by dduttman** [comment]
note that this failure was discovered when testing https://github.com/Azure/sonic-mgmt/blob/master/tests/vrf/test_vrf_attr.py
