### ISSUE TITLE
SNMP query over IPv6 does not work

### ISSUE THREAD

**Issue by SuvarnaMeenakshi** [Azure/sonic-buildimage#6108]
**Description**

**Steps to reproduce the issue:**
1. Update SNMP ACL rules so that the query over Loopback IP works, else ACLs by default will drop packets over loopback IP.
Example: 
admin@vlab-01:/tmp$ show acl rule
Table          Rule          Priority    Action    Match
-------------  ------------  ----------  --------  ------------------------------
IPV6_SNMP_ACL  RULE_1        9999        ACCEPT    DST_IPV6: FC00:1::32/128
                                                   IP_PROTOCOL: 17
SNMP_ACL       RULE_1        9999        ACCEPT    DST_IP: 10.1.0.32/32
                                                   IP_PROTOCOL: 17
2. From a BGP neighbor VM, send SNMP query over loopback IP, also run tcpdump on the front panel interface where the query would reach from neighbor.

3. From localhost, send SNMP query management IPv4 and IPv6 address.

**Describe the results you received:**
1. Over Loopback IP:
```
ARISTA04T1#bash snmpget -v2c -c public 10.1.0.32 1.3.6.1.2.1.1.1.0
SNMPv2-MIB::sysDescr.0 = STRING: SONiC Software Version: SONiC.master.557-e526d889 - HwSku: Force10-S6000 - Distribution: Debian 10.6 - Kernel: 4.19.0-9-2-amd64 - Works fine.

ARISTA04T1#bash snmpget -v2c -c public fc00:1::32 1.3.6.1.2.1.1.1.0
Timeout: No Response from fc00:1::32.
% 'snmpget -v2c -c public fc00:1::32 1.3.6.1.2.1.1.1.0' returned error code: 1
```
Tcpdump output:
```
admin@vlab-01:/tmp$ sudo tcpdump -i Ethernet112 port 161
tcpdump: verbose output suppressed, use -v or -vv for full protocol decode
listening on Ethernet112, link-type EN10MB (Ethernet), capture size 262144 bytes
02:11:01.895114 IP 10.0.0.57.51949 > 10.1.0.32.snmp:  GetRequest(28)  system.sysDescr.0
02:11:02.666053 IP 10.1.0.32.snmp > 10.0.0.57.51949:  GetResponse(157)  system.sysDescr.0="SONiC Software Version: SONiC.master.557-e526d889 - HwSku: Force10-S6000 - Distribution: Debian 10.6 - Kernel: 4.19.0-9-2-amd64" - IPv4 works

02:11:39.756233 IP6 fc00::72.48994 > fc00:1::32.snmp:  GetRequest(28)  system.sysDescr.0 - IPv6 No response goes out.
```
2. Over management IP:
```
snmpget -v2c -c public 10.250.0.101 1.3.6.1.2.1.1.1.0
iso.3.6.1.2.1.1.1.0 = STRING: "SONiC Software Version: SONiC.master.557-e526d889 - HwSku: Force10-S6000 - Distribution: Debian 10.6 - Kernel: 4.19.0-9-2-amd64" - works fine

 snmpget -v2c -c public fec0::ffff:afa:1 1.3.6.1.2.1.1.1.0
Timeout: No Response from fec0::ffff:afa:1.
```
Tcpdump output:
```
admin@vlab-01:/tmp$ sudo tcpdump -i eth0 port 161
tcpdump: verbose output suppressed, use -v or -vv for full protocol decode
listening on eth0, link-type EN10MB (Ethernet), capture size 262144 bytes
02:16:47.136026 IP 10.250.0.1.60998 > 10.250.0.101.snmp:  GetRequest(28)  system.sysDescr.0
02:16:47.880313 IP 10.250.0.101.snmp > 10.250.0.1.60998:  GetResponse(157)  system.sysDescr.0="SONiC Software Version: SONiC.master.557-e526d889 - HwSku: Force10-S6000 - Distribution: Debian 10.6 - Kernel: 4.19.0-9-2-amd64"
```
IPv6 are not coming in.

**Describe the results you expected:**
Should show the same result over Loopback IPv6 and Management IPv6 addresses.

**Additional information you deem important (e.g. issue happens only occasionally):**

    **Output of show version:**
```
show version

SONiC Software Version: SONiC.master.557-e526d889
Distribution: Debian 10.6
Kernel: 4.19.0-9-2-amd64
Build commit: e526d889
Build date: Mon Nov 16 07:40:25 UTC 2020
Built by: johnar@jenkins-worker-11

Platform: x86_64-kvm_x86_64-r0
HwSKU: Force10-S6000
ASIC: vs
Serial Number: 000000
```

    **Attach debug file `sudo generate_dump`:**

    ```
    (paste your output here)
    ```

**Comment by SuvarnaMeenakshi** [comment]
Fix is being discussed in the doc PR https://github.com/sonic-net/SONiC/pull/1457
